topic_id,top_words
0,"workshop, hxxps, com, career, campus, student, secure, join, click link, development, spot, let"
1,"account, library, verification, services, student, access, library account, verify, secure, thank, process, team"
2,"information, student, academic, update, enrollment, student information, office, thank, services, records, registrar, registrar office"
3,"com, click, hxxps, click link, let, hey, com let, join, club, challenge, fitness, campus"
4,"academic, thank, study, com, books, return, student, dear, hxxps, support, session, overdue"
5,"financial, aid, financial aid, dance, hxxps, com, click, join, click link, application, let, verification"
6,"account, security, verification, online, team, required, action, immediate, verify, thank, secure, update"
7,"student, services, account, student services, verification, confirm, department, thank, payment, regards, services department, leadership"
